{
  "$schema": "http://json-schema.org/draft-07/schema#",
  "$id": "https://raw.githubusercontent.com/rthepen/workout-database/main/schema/exercise.schema.json",
  "title": "Exercise",
  "description": "Standardized schema for exercise data within the Open-Source Workout Database.",
  "type": "object",
  "required": [
    "id",
    "exercise_name",
    "aliases",
    "material",
    "category",
    "target_muscles",
    "attributes",
    "instructions",
    "form_cues",
    "relations",
    "media",
    "meta"
  ],
  "additionalProperties": false,
  "properties": {
    "id": {
      "type": "string",
      "description": "Unique identifier in snake_case following [equipment]_[exercise_slug].",
      "pattern": "^[a-z0-9]+(?:_[a-z0-9]+)+$"
    },
    "exercise_name": {
      "type": "object",
      "description": "Localized names for the exercise.",
      "required": ["en", "nl"],
      "additionalProperties": false,
      "properties": {
        "en": {
          "type": "string",
          "minLength": 1,
          "description": "Exercise name in English."
        },
        "nl": {
          "type": "string",
          "minLength": 1,
          "description": "Exercise name in Dutch."
        }
      }
    },
    "aliases": {
      "type": "array",
      "description": "Alternative names or common variations for search indexing.",
      "items": {
        "type": "string"
      }
    },
    "material": {
      "type": "object",
      "description": "Equipment or apparatus required for this exercise.",
      "required": ["id", "name", "description"],
      "additionalProperties": false,
      "properties": {
        "id": {
          "type": "string",
          "description": "Unique slug for the material/equipment.",
          "pattern": "^[a-z0-9]+(?:_[a-z0-9]+)*$"
        },
        "name": {
          "type": "object",
          "required": ["en", "nl"],
          "additionalProperties": false,
          "properties": {
            "en": { "type": "string", "minLength": 1 },
            "nl": { "type": "string", "minLength": 1 }
          }
        },
        "description": {
          "type": "object",
          "required": ["en", "nl"],
          "additionalProperties": false,
          "properties": {
            "en": { "type": "string", "minLength": 1 },
            "nl": { "type": "string", "minLength": 1 }
          }
        }
      }
    },
    "category": {
      "type": "object",
      "description": "Localized training category or discipline.",
      "required": ["en", "nl"],
      "additionalProperties": false,
      "properties": {
        "en": { "type": "string", "minLength": 1 },
        "nl": { "type": "string", "minLength": 1 }
      }
    },
    "target_muscles": {
      "type": "object",
      "description": "Primary and secondary anatomical muscle groups engaged.",
      "required": ["primary", "secondary"],
      "additionalProperties": false,
      "properties": {
        "primary": {
          "type": "array",
          "minItems": 1,
          "items": {
            "$ref": "#/definitions/AnatomicalMuscle"
          }
        },
        "secondary": {
          "type": "array",
          "items": {
            "$ref": "#/definitions/AnatomicalMuscle"
          }
        }
      }
    },
    "attributes": {
      "type": "object",
      "description": "Biomechanical and tracking metadata.",
      "required": ["difficulty", "mechanics", "force_type", "tracking_type"],
      "additionalProperties": false,
      "properties": {
        "difficulty": {
          "type": "string",
          "enum": ["beginner", "intermediate", "advanced"]
        },
        "mechanics": {
          "type": "string",
          "enum": ["compound", "isolation", "isometric"]
        },
        "force_type": {
          "type": "string",
          "enum": ["push", "pull", "isometric", "dynamic"]
        },
        "tracking_type": {
          "type": "string",
          "enum": ["reps_only", "reps_and_weight", "time_only", "distance"]
        },
        "rating": {
          "type": "integer",
          "minimum": 1,
          "maximum": 5,
          "description": "Quality assessment rating score from 1 to 5 stars."
        }
      }
    },
    "instructions": {
      "type": "object",
      "description": "Step-by-step execution guides per language.",
      "required": ["en", "nl"],
      "additionalProperties": false,
      "properties": {
        "en": {
          "type": "array",
          "minItems": 1,
          "items": {
            "type": "string",
            "minLength": 1
          }
        },
        "nl": {
          "type": "array",
          "minItems": 1,
          "items": {
            "type": "string",
            "minLength": 1
          }
        }
      }
    },
    "form_cues": {
      "type": "object",
      "description": "Key coaching pointers and technique cues.",
      "required": ["en", "nl"],
      "additionalProperties": false,
      "properties": {
        "en": {
          "type": "array",
          "items": {
            "type": "string",
            "minLength": 1
          }
        },
        "nl": {
          "type": "array",
          "items": {
            "type": "string",
            "minLength": 1
          }
        }
      }
    },
    "relations": {
      "type": "object",
      "description": "Graph relations to related exercises.",
      "required": ["progressions", "regressions"],
      "additionalProperties": false,
      "properties": {
        "progressions": {
          "type": "array",
          "items": {
            "type": "string",
            "pattern": "^[a-z0-9]+(?:_[a-z0-9]+)+$"
          }
        },
        "regressions": {
          "type": "array",
          "items": {
            "type": "string",
            "pattern": "^[a-z0-9]+(?:_[a-z0-9]+)+$"
          }
        }
      }
    },
    "media": {
      "type": "object",
      "description": "Media assets and video links with multi-video fallback priority.",
      "required": ["videos"],
      "additionalProperties": false,
      "properties": {
        "videos": {
          "type": "array",
          "items": {
            "type": "object",
            "required": ["youtube_id", "type", "priority", "language"],
            "additionalProperties": false,
            "properties": {
              "youtube_id": {
                "type": "string",
                "pattern": "^[a-zA-Z0-9_-]{11}$",
                "description": "Exact 11-character YouTube video ID."
              },
              "type": {
                "type": "string",
                "enum": ["standard", "short"]
              },
              "priority": {
                "type": "integer",
                "minimum": 1,
                "description": "Fallback priority (1 = primary, 2 = secondary fallback)."
              },
              "start_seconds": {
                "type": "integer",
                "minimum": 0,
                "description": "Optional timestamp to begin movement playback."
              },
              "thumbnail_seconds": {
                "type": "integer",
                "minimum": 0,
                "description": "Timestamp for the best visual frame of the exercise for app thumbnail creation."
              },
              "language": {
                "type": "string",
                "enum": ["en", "nl", "none"],
                "description": "Audio or caption language code."
              },
              "rating": {
                "type": "integer",
                "minimum": 1,
                "maximum": 5,
                "description": "Quality assessment rating score (1-5 stars) for this video demonstration."
              },
              "thumbnail_rating": {
                "type": "integer",
                "minimum": 1,
                "maximum": 5,
                "description": "Quality assessment rating score (1-5 stars) for this thumbnail frame."
              },
              "custom_thumbnail_url": {
                "type": "string",
                "description": "Optional custom thumbnail image URL."
              },
              "aspect_ratio": {
                "type": "string",
                "enum": ["16:9", "9:16", "1:1", "4:3"],
                "description": "Video display aspect ratio (e.g. 16:9 for standard widescreen, 9:16 for vertical Shorts)."
              },
              "duration_seconds": {
                "type": "integer",
                "minimum": 0,
                "description": "Total playback runtime duration in seconds."
              },
              "channel": {
                "type": "string",
                "description": "YouTube channel or creator name."
              },
              "likes": {
                "type": "integer",
                "minimum": 0,
                "description": "Number of public YouTube likes."
              },
              "view_count": {
                "type": "integer",
                "minimum": 0,
                "description": "Total public YouTube view count."
              }
            }
          }
        },
        "images": {
          "type": "array",
          "description": "Optional image assets or custom diagrams.",
          "items": {
            "type": "object",
            "required": ["url"],
            "additionalProperties": false,
            "properties": {
              "url": { "type": "string" },
              "type": { "type": "string", "enum": ["thumbnail", "diagram", "photo"] },
              "rating": { "type": "integer", "minimum": 1, "maximum": 5 }
            }
          }
        }
      }
    },
    "meta": {
      "type": "object",
      "description": "Dataset versioning and change tracking metadata.",
      "required": ["schema_version", "updated_at"],
      "additionalProperties": false,
      "properties": {
        "schema_version": {
          "type": "string",
          "enum": ["1.1.0"]
        },
        "updated_at": {
          "type": "string",
          "pattern": "^\\d{4}-\\d{2}-\\d{2}(T\\d{2}:\\d{2}:\\d{2}(\\.\\d+)?(Z|[+-]\\d{2}:\\d{2})?)?$"
        }
      }
    }
  },
  "definitions": {
    "AnatomicalMuscle": {
      "type": "string",
      "enum": [
        "abductors",
        "adductors",
        "anterior_deltoid",
        "biceps_brachii",
        "brachialis",
        "calves",
        "cardiovascular_system",
        "deltoids",
        "erector_spinae",
        "forearms",
        "full_body",
        "gluteus_maximus",
        "gluteus_medius",
        "glutes",
        "hamstrings",
        "iliopsoas",
        "latissimus_dorsi",
        "lateral_deltoid",
        "obliques",
        "pectorals",
        "posterior_deltoid",
        "quadriceps",
        "rectus_abdominis",
        "rhomboids",
        "rotator_cuff",
        "tibialis_anterior",
        "transverse_abdominis",
        "trapezius",
        "triceps_brachii"
      ]
    }
  }
}
