[
  {
    "id": "foam_roller_adductor_stretch",
    "exercise_name": {
      "en": "Adductor Foam Roll",
      "nl": "Adductor Foam Roll"
    },
    "aliases": [
      "Adductor"
    ],
    "material": {
      "id": "foam_roller",
      "name": {
        "en": "Foam Roller",
        "nl": "Foamroller"
      },
      "description": {
        "en": "Dense foam cylinder used for self-myofascial release and muscle recovery",
        "nl": "Schuimcilinder voor zelfmassage, myofasciale release en spierherstel"
      }
    },
    "category": {
      "en": "Mobility & Stretching",
      "nl": "Mobiliteit & Rekken"
    },
    "target_muscles": {
      "primary": [
        "adductors"
      ],
      "secondary": []
    },
    "attributes": {
      "difficulty": "intermediate",
      "mechanics": "isolation",
      "force_type": "isometric",
      "tracking_type": "time_only"
    },
    "instructions": {
      "en": [
        "Lie face down with one leg on a foam roll.",
        "Rotate the leg so that the foam roll contacts against your inner thigh. Shift as much weight onto the foam roll as can be tolerated.",
        "While trying to relax the muscles if the inner thigh, roll over the foam between your hip and knee, holding points of tension for 10-30 seconds. Repeat with the other leg."
      ],
      "nl": [
        "Ga op je buik liggen met één been op de foamroller.",
        "Draai het been zodat de roller contact maakt met je binnenkant dij. Leun met zoveel mogelijk gewicht op de roller.",
        "Ontspan de spieren en rol rustig tussen heup en knie. Houd gevoelige punten 10-30 seconden vast en wissel van been."
      ]
    },
    "form_cues": {
      "en": [
        "Breathe slowly and maintain body control through forearms.",
        "Avoid rolling directly over the knee joint."
      ],
      "nl": [
        "Blijf rustig doorademen en ondersteun je lichaam met je onderarmen.",
        "Rol niet direct over het kniegewricht."
      ]
    },
    "relations": {
      "progressions": [],
      "regressions": []
    },
    "media": {
      "images": [
        {
          "url": "https://raw.githubusercontent.com/yuhonas/free-exercise-db/main/exercises/Adductor/0.jpg",
          "type": "photo"
        },
        {
          "url": "https://raw.githubusercontent.com/yuhonas/free-exercise-db/main/exercises/Adductor/1.jpg",
          "type": "photo"
        }
      ],
      "videos": []
    },
    "meta": {
      "schema_version": "1.1.0",
      "updated_at": "2026-09-09"
    }
  },
  {
    "id": "foam_roller_brachialis_smr",
    "exercise_name": {
      "en": "Brachialis Foam Roll",
      "nl": "Brachialis Foam Roll"
    },
    "aliases": [
      "Brachialis-SMR"
    ],
    "material": {
      "id": "foam_roller",
      "name": {
        "en": "Foam Roller",
        "nl": "Foamroller"
      },
      "description": {
        "en": "Dense foam cylinder used for self-myofascial release and muscle recovery",
        "nl": "Schuimcilinder voor zelfmassage, myofasciale release en spierherstel"
      }
    },
    "category": {
      "en": "Mobility & Stretching",
      "nl": "Mobiliteit & Rekken"
    },
    "target_muscles": {
      "primary": [
        "biceps_brachii"
      ],
      "secondary": []
    },
    "attributes": {
      "difficulty": "intermediate",
      "mechanics": "isolation",
      "force_type": "isometric",
      "tracking_type": "time_only"
    },
    "instructions": {
      "en": [
        "Lie on your side with the outside of your upper arm pressed firmly over a foam roller.",
        "Elevate hips slightly and roll slowly between elbow and shoulder.",
        "Pause on tight spots for 10-30 seconds, then switch arms."
      ],
      "nl": [
        "Ga op je zij liggen met de buitenkant van je bovenarm op de foamroller.",
        "Til je heupen iets op en rol langzaam tussen je elleboog en schouder.",
        "Houd gevoelige punten 10-30 seconden vast en wissel van arm."
      ]
    },
    "form_cues": {
      "en": [
        "Breathe steadily and maintain upper body support through your base arm.",
        "Avoid applying excessive pressure directly across the elbow joint."
      ],
      "nl": [
        "Adem rustig door en ondersteun jezelf met je andere arm.",
        "Rol niet over het ellebooggewricht zelf."
      ]
    },
    "relations": {
      "progressions": [],
      "regressions": []
    },
    "media": {
      "images": [
        {
          "url": "https://raw.githubusercontent.com/yuhonas/free-exercise-db/main/exercises/Brachialis-SMR/0.jpg",
          "type": "photo"
        },
        {
          "url": "https://raw.githubusercontent.com/yuhonas/free-exercise-db/main/exercises/Brachialis-SMR/1.jpg",
          "type": "photo"
        }
      ],
      "videos": []
    },
    "meta": {
      "schema_version": "1.1.0",
      "updated_at": "2026-09-09"
    }
  },
  {
    "id": "foam_roller_calves_smr",
    "exercise_name": {
      "en": "Calves Foam Roll",
      "nl": "Kuiten Foam Roll"
    },
    "aliases": [
      "Calves-SMR"
    ],
    "material": {
      "id": "foam_roller",
      "name": {
        "en": "Foam Roller",
        "nl": "Foamroller"
      },
      "description": {
        "en": "Dense foam cylinder used for self-myofascial release and muscle recovery",
        "nl": "Schuimcilinder voor zelfmassage, myofasciale release en spierherstel"
      }
    },
    "category": {
      "en": "Mobility & Stretching",
      "nl": "Mobiliteit & Rekken"
    },
    "target_muscles": {
      "primary": [
        "calves"
      ],
      "secondary": []
    },
    "attributes": {
      "difficulty": "intermediate",
      "mechanics": "isolation",
      "force_type": "isometric",
      "tracking_type": "time_only"
    },
    "instructions": {
      "en": [
        "Sit on the floor with a foam roller placed under your lower leg.",
        "Cross opposite leg over for extra pressure or keep it grounded for support.",
        "Press down with your hands to lift hips and roll between your ankle and knee.",
        "Pause on tight trigger points for 10-30 seconds, then switch legs."
      ],
      "nl": [
        "Ga op de grond zitten met de foamroller onder je kuit.",
        "Kruis je andere been eroverheen voor extra druk of zet je voet op de grond voor steun.",
        "Duw jezelf op met je handen en rol langzaam tussen je enkel en knieholte.",
        "Houd gevoelige plekken 10-30 seconden vast en wissel daarna van been."
      ]
    },
    "form_cues": {
      "en": [
        "Breathe steadily and avoid rolling directly behind the knee joint.",
        "Rotate foot inward and outward to target both medial and lateral calf heads."
      ],
      "nl": [
        "Blijf rustig ademen en rol niet direct in de knieholte.",
        "Draai je voet iets naar binnen en buiten om de hele kuitspier mee te pakken."
      ]
    },
    "relations": {
      "progressions": [],
      "regressions": []
    },
    "media": {
      "images": [
        {
          "url": "https://raw.githubusercontent.com/yuhonas/free-exercise-db/main/exercises/Calves-SMR/0.jpg",
          "type": "photo"
        },
        {
          "url": "https://raw.githubusercontent.com/yuhonas/free-exercise-db/main/exercises/Calves-SMR/1.jpg",
          "type": "photo"
        }
      ],
      "videos": []
    },
    "meta": {
      "schema_version": "1.1.0",
      "updated_at": "2026-09-09"
    }
  }
]
