[
  {
    "id": "strongman_atlas_stones",
    "exercise_name": {
      "en": "Atlas Stones",
      "nl": "Atlas Stones"
    },
    "aliases": [
      "Atlas Stones",
      "Atlas_Stones"
    ],
    "material": {
      "id": "other",
      "name": {
        "en": "Strongman Equipment / Stone",
        "nl": "Strongman Materiaal / Steen"
      },
      "description": {
        "en": "Heavy round stones and strongman loading implements",
        "nl": "Zware ronde stenen en strongman-apparatuur"
      }
    },
    "category": {
      "en": "Full Body",
      "nl": "Hele Lichaam"
    },
    "target_muscles": {
      "primary": [
        "erector_spinae"
      ],
      "secondary": [
        "rectus_abdominis",
        "biceps_brachii",
        "forearms",
        "glutes",
        "hamstrings",
        "quadriceps",
        "trapezius"
      ]
    },
    "attributes": {
      "difficulty": "advanced",
      "mechanics": "compound",
      "force_type": "pull",
      "tracking_type": "reps_and_weight"
    },
    "instructions": {
      "en": [
        "Begin with the atlas stone between your feet. Bend at the hips to wrap your arms vertically around the stone.",
        "Pulling the stone into your torso, drive through your feet to break the stone off the floor.",
        "Lap the stone by sitting back onto your thighs.",
        "Readjust grip over the stone, drive through your hips, and extend upward to load the stone onto the platform."
      ],
      "nl": [
        "Plaats de Atlas Stone tussen je voeten en klem je armen stevig om de steen.",
        "Til de steen van de grond door krachtig vanuit je benen en heupen te trekken.",
        "Plaats de steen op je schoot terwijl je in een squat zakt.",
        "Pak de steen over en strek explosief uit om de steen op het platform te leggen."
      ]
    },
    "form_cues": {
      "en": [
        "Maintain maximum torso tension and keep the stone tightly pinned against your chest.",
        "Drive forcefully with the hips to clear the loading height."
      ],
      "nl": [
        "Klem de steen strak tegen je borstkas en span je hele lichaam aan.",
        "Strek krachtig vanuit je heupen om hoogte te maken."
      ]
    },
    "relations": {
      "progressions": [],
      "regressions": []
    },
    "media": {
      "images": [
        {
          "url": "https://raw.githubusercontent.com/yuhonas/free-exercise-db/main/exercises/Atlas_Stones/0.jpg",
          "type": "photo"
        },
        {
          "url": "https://raw.githubusercontent.com/yuhonas/free-exercise-db/main/exercises/Atlas_Stones/1.jpg",
          "type": "photo"
        }
      ],
      "videos": []
    },
    "meta": {
      "schema_version": "1.1.0",
      "updated_at": "2026-09-09"
    }
  }
]
